{
  "item_id": "pm_2025-09-payments#L40",
  "source_type": "postmortem",
  "url": "gh:acme/infra/postmortems/2025-09-payments.md#L40",
  "content_hash": "sha256:d40ff53cd83e33e8f5253860a0960a114c0e2bf7e43ff09ccf078830c78c43e9",
  "entity_ids": ["ecs/payments-api"],
  "tool_ids": ["ecs.restart_service"],
  "trust_level": 0,
  "injection_flag": false
}
